{
  "bundle": {
    "detected": false,
    "patch": null,
    "patchExists": null
  },
  "crawl": {
    "enrichedAt": "2026-10-26T09:41:50.501Z",
    "enrichmentStatus": "ok",
    "headSha": "1cf8f0fdb966edba205e083a805cf4ea30a23e74"
  },
  "github": {
    "archived": false,
    "createdAt": "2026-08-13T14:04:13Z",
    "databaseId": 1333183535,
    "defaultBranch": "master",
    "description": null,
    "fork": true,
    "forks": 0,
    "headSha": "1cf8f0fdb966edba205e083a805cf4ea30a23e74",
    "homepageUrl": null,
    "language": "TypeScript",
    "license": {
      "name": "MIT License",
      "spdxId": "MIT"
    },
    "nodeId": "R_kgDOT3bELw",
    "openGraphImageUrl": "https://opengraph.githubassets.com/829318383d736cac52e86a054c913ebc5949dc49be5ae1e446bd6698fb1cbb53/ryanyujazz-dev/deepseek-harness",
    "owner": {
      "avatarUrl": "https://avatars.githubusercontent.com/u/262982386?v=4",
      "login": "ryanyujazz-dev"
    },
    "pushedAt": "2026-08-16T06:12:52Z",
    "slug": "ryanyujazz-dev/deepseek-harness",
    "stars": 0,
    "topics": [
      "deepseek-harness",
      "dsh-plugin"
    ],
    "updatedAt": "2026-08-16T06:47:52Z",
    "url": "https://github.com/ryanyujazz-dev/deepseek-harness"
  },
  "id": "gh:1333183535",
  "install": {
    "available": false,
    "packageName": null,
    "preferred": null,
    "reason": "Repository does not expose an installable DSH bundle.",
    "requiresBuildApproval": false,
    "spec": null,
    "version": null
  },
  "npm": {
    "latestVersion": null,
    "published": false,
    "repositoryMatches": null
  },
  "package": {
    "main": null,
    "name": "@deepseek-ai/dsh-root",
    "status": "valid",
    "type": "module",
    "version": "0.1.0-rc.5"
  },
  "presentation": {
    "coverUrl": "https://opengraph.githubassets.com/829318383d736cac52e86a054c913ebc5949dc49be5ae1e446bd6698fb1cbb53/ryanyujazz-dev/deepseek-harness",
    "description": "DeepSeek Harness (dsh) is an open-source agent harness developed by DeepSeek AI."
  },
  "readme": {
    "available": true,
    "excerpt": "DeepSeek Harness (dsh) is an open-source agent harness developed by DeepSeek AI."
  },
  "schemaVersion": 1,
  "scripts": {
    "install": false,
    "postinstall": true,
    "preinstall": false,
    "prepare": false
  }
}
