{
  "bundle": {
    "detected": true,
    "patch": "./cordis.patch.yml",
    "patchExists": true
  },
  "crawl": {
    "enrichedAt": "2026-10-13T11:15:58.128Z",
    "enrichmentStatus": "stale",
    "headSha": "e25710f1a3d0aee936e1ce033afc770a8890c232"
  },
  "github": {
    "archived": false,
    "createdAt": "2026-08-20T23:04:14Z",
    "databaseId": 1341210332,
    "defaultBranch": "main",
    "description": "古巴国家",
    "fork": false,
    "forks": 0,
    "headSha": "e25710f1a3d0aee936e1ce033afc770a8890c232",
    "homepageUrl": null,
    "language": "JavaScript",
    "license": {
      "name": "MIT License",
      "spdxId": "MIT"
    },
    "nodeId": "R_kgDOT_E-3A",
    "openGraphImageUrl": "https://opengraph.githubassets.com/61f4e200ee06e63d48f6935cbf8e736cf4b57a0d9f78eefd7c09718c5eb01e87/uckkk/dsh-cuba",
    "owner": {
      "avatarUrl": "https://avatars.githubusercontent.com/u/12168513?u=05cb61b3c2c76c6182e732585aaec8a8afbdcc36&v=4",
      "login": "uckkk"
    },
    "pushedAt": "2026-08-20T23:04:22Z",
    "slug": "uckkk/dsh-cuba",
    "stars": 0,
    "topics": [
      "deepseek-harness",
      "dsh-plugin"
    ],
    "updatedAt": "2026-09-18T03:44:47Z",
    "url": "https://github.com/uckkk/dsh-cuba"
  },
  "id": "gh:1341210332",
  "install": {
    "available": true,
    "packageName": "dsh-cuba",
    "preferred": "github",
    "reason": null,
    "requiresBuildApproval": false,
    "spec": "github:uckkk/dsh-cuba#e25710f1a3d0aee936e1ce033afc770a8890c232",
    "version": "0.1.0"
  },
  "npm": {
    "latestVersion": null,
    "published": false,
    "repositoryMatches": null
  },
  "package": {
    "exports": {
      ".": "./lib/index.js",
      "./cordis.patch.yml": "./cordis.patch.yml",
      "./package.json": "./package.json"
    },
    "main": "lib/index.js",
    "name": "dsh-cuba",
    "status": "valid",
    "type": "module",
    "version": "0.1.0"
  },
  "presentation": {
    "coverUrl": "https://opengraph.githubassets.com/61f4e200ee06e63d48f6935cbf8e736cf4b57a0d9f78eefd7c09718c5eb01e87/uckkk/dsh-cuba",
    "description": "古巴国家"
  },
  "readme": {
    "available": true,
    "excerpt": "纯 Node 实现，无网络依赖。"
  },
  "schemaVersion": 1,
  "scripts": {
    "install": false,
    "postinstall": false,
    "preinstall": false,
    "prepare": false
  }
}
