{
  "bundle": {
    "detected": true,
    "patch": "./cordis.patch.yml",
    "patchExists": true
  },
  "crawl": {
    "enrichedAt": "2026-10-21T09:20:09.852Z",
    "enrichmentStatus": "stale",
    "headSha": "1fdbbdde88d43131090372d398e363048c5ed158"
  },
  "github": {
    "archived": false,
    "createdAt": "2026-09-29T22:15:00Z",
    "databaseId": 1396651596,
    "defaultBranch": "main",
    "description": "DSH plugin: show the signed-in DeepSeek account's Platform wallet next to the DEEPSEEK_API_KEY balance, as one pill in the composer stats band",
    "fork": false,
    "forks": 0,
    "headSha": "1fdbbdde88d43131090372d398e363048c5ed158",
    "homepageUrl": null,
    "language": "JavaScript",
    "license": {
      "name": "MIT License",
      "spdxId": "MIT"
    },
    "nodeId": "R_kgDOUz82TA",
    "openGraphImageUrl": "https://opengraph.githubassets.com/17e1c73ec6443f02b32f0ff6c6a38389db14101e1df0bdbfb2fbf00a7819eb15/fangweixuan26-hash/dsh-dual-balance",
    "owner": {
      "avatarUrl": "https://avatars.githubusercontent.com/u/260001352?v=4",
      "login": "fangweixuan26-hash"
    },
    "pushedAt": "2026-09-29T22:20:17Z",
    "slug": "fangweixuan26-hash/dsh-dual-balance",
    "stars": 1,
    "topics": [
      "account-balance",
      "api-balance",
      "balance",
      "cordis",
      "deepseek",
      "deepseek-harness",
      "dsh",
      "dsh-plugin",
      "plugin",
      "quota",
      "status-bar",
      "web"
    ],
    "updatedAt": "2026-10-01T01:18:42Z",
    "url": "https://github.com/fangweixuan26-hash/dsh-dual-balance"
  },
  "id": "gh:1396651596",
  "install": {
    "available": true,
    "packageName": "dsh-dual-balance",
    "preferred": "github",
    "reason": null,
    "requiresBuildApproval": false,
    "spec": "github:fangweixuan26-hash/dsh-dual-balance#1fdbbdde88d43131090372d398e363048c5ed158",
    "version": "0.1.0"
  },
  "npm": {
    "latestVersion": "0.1.1",
    "published": true,
    "repositoryMatches": false
  },
  "package": {
    "exports": {
      ".": "./lib/index.js",
      "./client": "./lib/client.js",
      "./package.json": "./package.json"
    },
    "main": "lib/index.js",
    "name": "dsh-dual-balance",
    "status": "valid",
    "type": "module",
    "version": "0.1.0"
  },
  "presentation": {
    "coverUrl": "https://opengraph.githubassets.com/17e1c73ec6443f02b32f0ff6c6a38389db14101e1df0bdbfb2fbf00a7819eb15/fangweixuan26-hash/dsh-dual-balance",
    "description": "DSH plugin: show the signed-in DeepSeek account's Platform wallet next to the DEEPSEEK_API_KEY balance, as one pill in the composer stats band"
  },
  "readme": {
    "available": true,
    "excerpt": "真实截图：余额 ¥9.49 就是本插件，夹在官方的 1 轮 239 步 · 280 tok/s、65M tok · 缓存命中 99.6% 和上下文环之间——同一行、同一字号、同一套图标语言。"
  },
  "schemaVersion": 1,
  "scripts": {
    "install": false,
    "postinstall": false,
    "preinstall": false,
    "prepare": false
  }
}
