{
  "bundle": {
    "detected": false,
    "patch": null,
    "patchExists": null
  },
  "crawl": {
    "enrichedAt": "2026-10-28T10:31:16.080Z",
    "enrichmentStatus": "ok",
    "headSha": "1a6591dbe30ca693c30b754af02b7defe645283e"
  },
  "github": {
    "archived": false,
    "createdAt": "2026-08-14T08:01:28Z",
    "databaseId": 1333944072,
    "defaultBranch": "main",
    "description": "DSH / DeepSeek Harness plugin: runtime secret & PII redaction with mask, reversible vault and execution-time substitution",
    "fork": false,
    "forks": 0,
    "headSha": "1a6591dbe30ca693c30b754af02b7defe645283e",
    "homepageUrl": "https://deepseek-harness.github.io/deepseek-harness/develop/basic/",
    "language": "TypeScript",
    "license": {
      "name": "MIT License",
      "spdxId": "MIT"
    },
    "nodeId": "R_kgDOT4JfCA",
    "openGraphImageUrl": "https://opengraph.githubassets.com/112ce32fd6fe153a86b1ae104f78379baa05d00516d8d8fbefbcfb51abc8c284/dingge001/dsh-redact",
    "owner": {
      "avatarUrl": "https://avatars.githubusercontent.com/u/65606798?u=ded38c87e99b8d5fb44ca953ce731074ab4cb278&v=4",
      "login": "dingge001"
    },
    "pushedAt": "2026-08-14T08:18:47Z",
    "slug": "dingge001/dsh-redact",
    "stars": 0,
    "topics": [
      "agent-security",
      "ai-security",
      "cordis",
      "data-masking",
      "data-protection",
      "deepseek",
      "deepseek-harness",
      "dsh",
      "dsh-plugin",
      "llm",
      "llm-security",
      "nodejs",
      "pii",
      "privacy",
      "redaction",
      "secret-management",
      "secrets",
      "security",
      "typescript",
      "vault"
    ],
    "updatedAt": "2026-09-12T00:29:35Z",
    "url": "https://github.com/dingge001/dsh-redact"
  },
  "id": "gh:1333944072",
  "install": {
    "available": false,
    "packageName": null,
    "preferred": null,
    "reason": "Repository does not expose an installable DSH bundle.",
    "requiresBuildApproval": false,
    "spec": null,
    "version": null
  },
  "npm": {
    "latestVersion": null,
    "published": false,
    "repositoryMatches": null
  },
  "package": {
    "main": null,
    "name": "dsh-redact",
    "status": "valid",
    "type": "module",
    "version": "0.1.0"
  },
  "presentation": {
    "coverUrl": "https://opengraph.githubassets.com/112ce32fd6fe153a86b1ae104f78379baa05d00516d8d8fbefbcfb51abc8c284/dingge001/dsh-redact",
    "description": "DSH / DeepSeek Harness plugin: runtime secret & PII redaction with mask, reversible vault and execution-time substitution"
  },
  "readme": {
    "available": true,
    "excerpt": "dsh-redact 是 DeepSeek Harness（DSH）的运行时、源头、可逆、可代填执行的密钥 / PII 脱敏插件。它在数据进入「模型」与「canonical 会话日志」之前完成处理，保持 DSH 的「模型可见即已记录」不变量：模型看到什么，日志就记录什么——但都已经是脱敏后的内容。"
  },
  "schemaVersion": 1,
  "scripts": {
    "install": false,
    "postinstall": false,
    "preinstall": false,
    "prepare": false
  }
}
