{
  "bundle": {
    "detected": true,
    "patch": "./cordis.patch.yml",
    "patchExists": true
  },
  "crawl": {
    "enrichedAt": "2026-10-31T10:23:43.510Z",
    "enrichmentStatus": "stale",
    "headSha": "f96dd61cca94c9ecf6fb2da87c9f47111a4de968"
  },
  "github": {
    "archived": false,
    "createdAt": "2026-10-25T08:07:39Z",
    "databaseId": 1432965984,
    "defaultBranch": "main",
    "description": "装插件前替你看一眼：会不会撞名、缺什么。One look before a DSH plugin lands: collisions, missing pieces.",
    "fork": false,
    "forks": 0,
    "headSha": "f96dd61cca94c9ecf6fb2da87c9f47111a4de968",
    "homepageUrl": null,
    "language": "JavaScript",
    "license": {
      "name": "MIT License",
      "spdxId": "MIT"
    },
    "nodeId": "R_kgDOVWlTYA",
    "openGraphImageUrl": "https://opengraph.githubassets.com/ebdd57999c3a930ec9540b196ef05edd98987838124328d01efdec8a91376a62/regrevia/dsh-install-check",
    "owner": {
      "avatarUrl": "https://avatars.githubusercontent.com/u/189863248?u=b7c6ef1352706f3004d5f1a22dea8d3659f36bed&v=4",
      "login": "regrevia"
    },
    "pushedAt": "2026-10-29T10:31:22Z",
    "slug": "regrevia/dsh-install-check",
    "stars": 1,
    "topics": [
      "deepseek-harness",
      "dsh",
      "dsh-plugin"
    ],
    "updatedAt": "2026-10-30T10:00:53Z",
    "url": "https://github.com/regrevia/dsh-install-check"
  },
  "id": "gh:1432965984",
  "install": {
    "available": true,
    "packageName": "dsh-install-check",
    "preferred": "npm",
    "reason": null,
    "requiresBuildApproval": false,
    "spec": "dsh-install-check@0.1.5",
    "version": "0.1.5"
  },
  "npm": {
    "latestVersion": "0.1.5",
    "published": true,
    "repositoryMatches": true
  },
  "package": {
    "exports": {
      ".": "./index.js",
      "./icon": "./icon.svg",
      "./locale/*.json": "./locale/*.json"
    },
    "main": null,
    "name": "dsh-install-check",
    "status": "valid",
    "type": "module",
    "version": "0.1.5"
  },
  "presentation": {
    "coverUrl": "https://opengraph.githubassets.com/ebdd57999c3a930ec9540b196ef05edd98987838124328d01efdec8a91376a62/regrevia/dsh-install-check",
    "description": "装插件前替你看一眼：会不会撞名、缺什么。One look before a DSH plugin lands: collisions, missing pieces."
  },
  "readme": {
    "available": true,
    "excerpt": "中文名：插件无忧装"
  },
  "schemaVersion": 1,
  "scripts": {
    "install": false,
    "postinstall": false,
    "preinstall": false,
    "prepare": false
  }
}
