{
  "bundle": {
    "detected": false,
    "patch": null,
    "patchExists": null
  },
  "crawl": {
    "enrichedAt": "2026-10-11T10:31:16.108Z",
    "enrichmentStatus": "ok",
    "headSha": "abadf9e9a70bee9fa3e9e7fca4111c8695e6924a"
  },
  "github": {
    "archived": false,
    "createdAt": "2026-08-22T15:19:28Z",
    "databaseId": 1342926207,
    "defaultBranch": "master",
    "description": "DSH Harmony 客户端 搭配 dsh-pocket 使用",
    "fork": false,
    "forks": 0,
    "headSha": "abadf9e9a70bee9fa3e9e7fca4111c8695e6924a",
    "homepageUrl": null,
    "language": "Shell",
    "license": {
      "name": "MIT License",
      "spdxId": "MIT"
    },
    "nodeId": "R_kgDOUAttfw",
    "openGraphImageUrl": "https://opengraph.githubassets.com/4a7675464acfc09b2927ab5c6a82e5fba0dcc28d7ed6275228fedd10500a25ea/enoughpower/dsh-harmony",
    "owner": {
      "avatarUrl": "https://avatars.githubusercontent.com/u/14027606?u=5ef6cb9a8bc6c706f490e45acbdecd7493b5254d&v=4",
      "login": "enoughpower"
    },
    "pushedAt": "2026-09-21T04:28:20Z",
    "slug": "enoughpower/dsh-harmony",
    "stars": 2,
    "topics": [
      "dsh-plugin",
      "harmonyos"
    ],
    "updatedAt": "2026-10-05T06:52:02Z",
    "url": "https://github.com/enoughpower/dsh-harmony"
  },
  "id": "gh:1342926207",
  "install": {
    "available": false,
    "packageName": null,
    "preferred": null,
    "reason": "Repository does not expose an installable DSH bundle.",
    "requiresBuildApproval": false,
    "spec": null,
    "version": null
  },
  "npm": {
    "latestVersion": null,
    "published": false,
    "repositoryMatches": null
  },
  "package": {
    "main": null,
    "name": "dsh-harmony",
    "status": "valid",
    "type": null,
    "version": "1.0.0"
  },
  "presentation": {
    "coverUrl": "https://opengraph.githubassets.com/4a7675464acfc09b2927ab5c6a82e5fba0dcc28d7ed6275228fedd10500a25ea/enoughpower/dsh-harmony",
    "description": "DSH Harmony 客户端 搭配 dsh-pocket 使用"
  },
  "readme": {
    "available": true,
    "excerpt": "DeepSeek Harness 的 HarmonyOS 原生客户端，与 dsh-pocket 插件配套使用：手机扫一扫电脑端 DSH 设置页的二维码，即可在手机上实时使用电脑上的 DeepSeek Harness。"
  },
  "schemaVersion": 1,
  "scripts": {
    "install": false,
    "postinstall": false,
    "preinstall": false,
    "prepare": false
  }
}
