{
  "bundle": {
    "detected": true,
    "patch": "./cordis.patch.yml",
    "patchExists": true
  },
  "crawl": {
    "enrichedAt": "2026-10-11T10:31:16.108Z",
    "enrichmentStatus": "ok",
    "headSha": "50d6d9c63602d1cd1cf397d46a925d03f5c336b7"
  },
  "github": {
    "archived": false,
    "createdAt": "2026-08-16T00:18:53Z",
    "databaseId": 1335516116,
    "defaultBranch": "main",
    "description": "Paper Design plugin for DeepSeek Harness",
    "fork": false,
    "forks": 0,
    "headSha": "50d6d9c63602d1cd1cf397d46a925d03f5c336b7",
    "homepageUrl": null,
    "language": "TypeScript",
    "license": {
      "name": "MIT License",
      "spdxId": "MIT"
    },
    "nodeId": "R_kgDOT5pb1A",
    "openGraphImageUrl": "https://opengraph.githubassets.com/65dbf566376f7940ad6979322903076187649c5edaa03fc546453836980effc6/try-works/dsh-paper-design",
    "owner": {
      "avatarUrl": "https://avatars.githubusercontent.com/u/262919414?u=c3d138bac1cba976c585334c0aba14fb05664bbb&v=4",
      "login": "try-works"
    },
    "pushedAt": "2026-10-07T02:23:31Z",
    "slug": "try-works/dsh-paper-design",
    "stars": 2,
    "topics": [
      "dsh",
      "dsh-paper-design",
      "dsh-plugin",
      "paper",
      "paper-design"
    ],
    "updatedAt": "2026-10-07T02:23:35Z",
    "url": "https://github.com/try-works/dsh-paper-design"
  },
  "id": "gh:1335516116",
  "install": {
    "available": true,
    "packageName": "@try-works/dsh-paper-design",
    "preferred": "npm",
    "reason": null,
    "requiresBuildApproval": false,
    "spec": "@try-works/dsh-paper-design@0.1.5",
    "version": "0.1.5"
  },
  "npm": {
    "latestVersion": "0.1.5",
    "published": true,
    "repositoryMatches": true
  },
  "package": {
    "exports": {
      ".": {
        "default": "./src/index.ts",
        "types": "./src/index.ts"
      },
      "./cordis.patch.yml": "./cordis.patch.yml",
      "./package.json": "./package.json",
      "./src/*": "./src/*"
    },
    "main": "./src/index.ts",
    "name": "@try-works/dsh-paper-design",
    "status": "valid",
    "type": "module",
    "version": "0.1.5"
  },
  "presentation": {
    "coverUrl": "https://opengraph.githubassets.com/65dbf566376f7940ad6979322903076187649c5edaa03fc546453836980effc6/try-works/dsh-paper-design",
    "description": "Paper Design plugin for DeepSeek Harness"
  },
  "readme": {
    "available": true,
    "excerpt": "Paper Design MCP bridge as a DeepSeek Harness bundle."
  },
  "schemaVersion": 1,
  "scripts": {
    "install": false,
    "postinstall": false,
    "preinstall": false,
    "prepare": false
  }
}
