{
  "bundle": {
    "detected": true,
    "patch": "./cordis.patch.yml",
    "patchExists": true
  },
  "crawl": {
    "enrichedAt": "2026-10-27T09:53:24.843Z",
    "enrichmentStatus": "ok",
    "headSha": "d00249ca21d3ecaf43277fa00a60803ea7455937"
  },
  "github": {
    "archived": false,
    "createdAt": "2026-08-19T04:03:26Z",
    "databaseId": 1339074326,
    "defaultBranch": "main",
    "description": "一个适用于dsh网页版的任务提示小插件",
    "fork": false,
    "forks": 0,
    "headSha": "d00249ca21d3ecaf43277fa00a60803ea7455937",
    "homepageUrl": null,
    "language": "JavaScript",
    "license": {
      "name": "MIT License",
      "spdxId": "MIT"
    },
    "nodeId": "R_kgDOT9CnFg",
    "openGraphImageUrl": "https://opengraph.githubassets.com/88ad6d9f4c4e0747cf4782f667f0b690805641ee462090ff90555c2d81259329/Talone22/dsh-notify-tone",
    "owner": {
      "avatarUrl": "https://avatars.githubusercontent.com/u/187104427?u=15e8acd62bbfdeb38f83294ffe2f38554d28dbf5&v=4",
      "login": "Talone22"
    },
    "pushedAt": "2026-08-22T12:34:38Z",
    "slug": "Talone22/dsh-notify-tone",
    "stars": 4,
    "topics": [
      "deepseek-harness",
      "dsh-plugin"
    ],
    "updatedAt": "2026-10-21T00:56:58Z",
    "url": "https://github.com/Talone22/dsh-notify-tone"
  },
  "id": "gh:1339074326",
  "install": {
    "available": true,
    "packageName": "dsh-notify-tone",
    "preferred": "npm",
    "reason": null,
    "requiresBuildApproval": false,
    "spec": "dsh-notify-tone@0.2.3",
    "version": "0.2.3"
  },
  "npm": {
    "latestVersion": "0.2.3",
    "published": true,
    "repositoryMatches": true
  },
  "package": {
    "exports": {
      ".": "./lib/index.js",
      "./client": "./lib/client.js",
      "./package.json": "./package.json"
    },
    "main": "lib/index.js",
    "name": "dsh-notify-tone",
    "status": "valid",
    "type": "module",
    "version": "0.2.3"
  },
  "presentation": {
    "coverUrl": "https://opengraph.githubassets.com/88ad6d9f4c4e0747cf4782f667f0b690805641ee462090ff90555c2d81259329/Talone22/dsh-notify-tone",
    "description": "dsh web GUI 的提醒插件："
  },
  "readme": {
    "available": true,
    "excerpt": "dsh web GUI 的提醒插件："
  },
  "schemaVersion": 1,
  "scripts": {
    "install": false,
    "postinstall": false,
    "preinstall": false,
    "prepare": false
  }
}
