{
  "bundle": {
    "detected": true,
    "patch": "./cordis.patch.yml",
    "patchExists": true
  },
  "crawl": {
    "enrichedAt": "2026-10-13T11:15:58.128Z",
    "enrichmentStatus": "ok",
    "headSha": "e77bdfd860aa0f71740a45ca30d3d898a4456265"
  },
  "github": {
    "archived": false,
    "createdAt": "2026-09-27T03:32:06Z",
    "databaseId": 1390044301,
    "defaultBranch": "main",
    "description": "dsh 插件：本地语音/视频转写——QQ/微信那种 SILK 语音先解码，再用 SenseVoice 转成文字，全程不花 API 钱（约 0.1 秒/条） · Local speech-to-text for dsh: SILK decoding + SenseVoice (sherpa-onnx int8), no API cost, ~0.1 s per clip.",
    "fork": false,
    "forks": 0,
    "headSha": "e77bdfd860aa0f71740a45ca30d3d898a4456265",
    "homepageUrl": null,
    "language": "Python",
    "license": {
      "name": "MIT License",
      "spdxId": "MIT"
    },
    "nodeId": "R_kgDOUtpkjQ",
    "openGraphImageUrl": "https://opengraph.githubassets.com/876ba077334e1f1979d497cf96d3d49e756eca169d92a97822465a78f9ea5179/JackZo400/dsh-voice-transcribe",
    "owner": {
      "avatarUrl": "https://avatars.githubusercontent.com/u/163442182?u=920ef8c2a6a6df0f72a94c46f97dd376c049d104&v=4",
      "login": "JackZo400"
    },
    "pushedAt": "2026-09-28T04:39:16Z",
    "slug": "JackZo400/dsh-voice-transcribe",
    "stars": 0,
    "topics": [
      "asr",
      "cordis",
      "deepseek-harness",
      "dsh",
      "dsh-plugin",
      "qq",
      "sensevoice",
      "silk",
      "transcribe",
      "voice"
    ],
    "updatedAt": "2026-10-01T00:41:18Z",
    "url": "https://github.com/JackZo400/dsh-voice-transcribe"
  },
  "id": "gh:1390044301",
  "install": {
    "available": true,
    "packageName": "dsh-voice-transcribe",
    "preferred": "github",
    "reason": null,
    "requiresBuildApproval": false,
    "spec": "github:JackZo400/dsh-voice-transcribe#e77bdfd860aa0f71740a45ca30d3d898a4456265",
    "version": "0.1.0"
  },
  "npm": {
    "latestVersion": null,
    "published": false,
    "repositoryMatches": null
  },
  "package": {
    "exports": {
      ".": "./index.js",
      "./package.json": "./package.json"
    },
    "main": null,
    "name": "dsh-voice-transcribe",
    "status": "valid",
    "type": "module",
    "version": "0.1.0"
  },
  "presentation": {
    "coverUrl": "https://opengraph.githubassets.com/876ba077334e1f1979d497cf96d3d49e756eca169d92a97822465a78f9ea5179/JackZo400/dsh-voice-transcribe",
    "description": "dsh 插件：本地语音/视频转写——QQ/微信那种 SILK 语音先解码，再用 SenseVoice 转成文字，全程不花 API 钱（约 0.1 秒/条） · Local speech-to-text for dsh: SILK decoding + SenseVoice (sherpa-onnx int8), no API cost, ~0.1 s per clip."
  },
  "readme": {
    "available": true,
    "excerpt": "给 DeepSeek Harness（dsh）用的本地语音/视频转写插件： 让 Agent「听得见」——把一个音频或视频文件交给它，它把里面的话转成文字。"
  },
  "schemaVersion": 1,
  "scripts": {
    "install": false,
    "postinstall": false,
    "preinstall": false,
    "prepare": false
  }
}
