{
  "bundle": {
    "detected": true,
    "patch": "./cordis.patch.yml",
    "patchExists": true
  },
  "crawl": {
    "enrichedAt": "2026-10-18T08:38:39.505Z",
    "enrichmentStatus": "stale",
    "headSha": "95947d8a667603c3594f7584d6d67e68ecf3c2e8"
  },
  "github": {
    "archived": false,
    "createdAt": "2026-08-20T18:37:18Z",
    "databaseId": 1341036762,
    "defaultBranch": "main",
    "description": "应季选茶",
    "fork": false,
    "forks": 0,
    "headSha": "95947d8a667603c3594f7584d6d67e68ecf3c2e8",
    "homepageUrl": null,
    "language": "JavaScript",
    "license": {
      "name": "MIT License",
      "spdxId": "MIT"
    },
    "nodeId": "R_kgDOT-6Y2g",
    "openGraphImageUrl": "https://opengraph.githubassets.com/aaa82d2d296a46e93f29af577b7090a123c03b384ea31fccac1d78bb500fd82a/uckkk/dsh-tea-pick",
    "owner": {
      "avatarUrl": "https://avatars.githubusercontent.com/u/12168513?u=05cb61b3c2c76c6182e732585aaec8a8afbdcc36&v=4",
      "login": "uckkk"
    },
    "pushedAt": "2026-08-20T18:37:26Z",
    "slug": "uckkk/dsh-tea-pick",
    "stars": 0,
    "topics": [
      "deepseek-harness",
      "dsh-plugin"
    ],
    "updatedAt": "2026-08-20T18:41:09Z",
    "url": "https://github.com/uckkk/dsh-tea-pick"
  },
  "id": "gh:1341036762",
  "install": {
    "available": true,
    "packageName": "dsh-tea-pick",
    "preferred": "github",
    "reason": null,
    "requiresBuildApproval": false,
    "spec": "github:uckkk/dsh-tea-pick#95947d8a667603c3594f7584d6d67e68ecf3c2e8",
    "version": "0.1.0"
  },
  "npm": {
    "latestVersion": null,
    "published": false,
    "repositoryMatches": null
  },
  "package": {
    "exports": {
      ".": "./lib/index.js",
      "./cordis.patch.yml": "./cordis.patch.yml",
      "./package.json": "./package.json"
    },
    "main": "lib/index.js",
    "name": "dsh-tea-pick",
    "status": "valid",
    "type": "module",
    "version": "0.1.0"
  },
  "presentation": {
    "coverUrl": "https://opengraph.githubassets.com/aaa82d2d296a46e93f29af577b7090a123c03b384ea31fccac1d78bb500fd82a/uckkk/dsh-tea-pick",
    "description": "应季选茶"
  },
  "readme": {
    "available": true,
    "excerpt": "纯 Node 实现，无网络依赖。"
  },
  "schemaVersion": 1,
  "scripts": {
    "install": false,
    "postinstall": false,
    "preinstall": false,
    "prepare": false
  }
}
