{
  "bundle": {
    "detected": true,
    "patch": "./cordis.patch.yml",
    "patchExists": true
  },
  "crawl": {
    "enrichedAt": "2026-10-26T09:41:50.501Z",
    "enrichmentStatus": "ok",
    "headSha": "afd7d1eb578a621ffc66a74f2f5774c63bec001b"
  },
  "github": {
    "archived": false,
    "createdAt": "2026-08-14T06:28:25Z",
    "databaseId": 1333870105,
    "defaultBranch": "main",
    "description": "The Feishu UI for DeepSeek Harness  — a panel-driven control console: every slash command a button on the ⚙️ control-panel card, in-card approvals & questions, live streaming cards, one-QR setup. | DeepSeek Harness 的飞书 UI：面板驱动控制台——每个命令都是卡片按钮，卡内审批与提问，流式卡片，扫码一键配置。",
    "fork": false,
    "forks": 3,
    "headSha": "afd7d1eb578a621ffc66a74f2f5774c63bec001b",
    "homepageUrl": null,
    "language": "TypeScript",
    "license": {
      "name": "MIT License",
      "spdxId": "MIT"
    },
    "nodeId": "R_kgDOT4E-GQ",
    "openGraphImageUrl": "https://opengraph.githubassets.com/38bc09c5d4dcc8686a3d9872e2bbd3803c4e05f822612c37d421e81887a19d13/PGZXB/dsh-feishu",
    "owner": {
      "avatarUrl": "https://avatars.githubusercontent.com/u/52557189?u=8b903ea8e1ce5bc963351172f57035b9239df004&v=4",
      "login": "PGZXB"
    },
    "pushedAt": "2026-10-24T20:48:17Z",
    "slug": "PGZXB/dsh-feishu",
    "stars": 33,
    "topics": [
      "ai-agent",
      "bot",
      "chatbot",
      "coding-agent",
      "cordis",
      "deepseek",
      "deepseek-harness",
      "dsh",
      "dsh-plugin",
      "feishu",
      "feishu-bot",
      "im-bot",
      "interactive-cards",
      "lark",
      "llm",
      "nodejs",
      "streaming",
      "typescript",
      "websocket"
    ],
    "updatedAt": "2026-10-24T20:48:10Z",
    "url": "https://github.com/PGZXB/dsh-feishu"
  },
  "id": "gh:1333870105",
  "install": {
    "available": false,
    "packageName": null,
    "preferred": null,
    "reason": "Repository does not expose a ready package entry point.",
    "requiresBuildApproval": false,
    "spec": null,
    "version": null
  },
  "npm": {
    "latestVersion": "0.3.7",
    "published": true,
    "repositoryMatches": false
  },
  "package": {
    "exports": {
      ".": {
        "default": "./lib/index.js",
        "types": "./lib/index.d.ts"
      },
      "./cordis.patch.yml": "./cordis.patch.yml",
      "./package.json": "./package.json"
    },
    "main": "lib/index.js",
    "name": "@dsh-feishu/dsh-feishu",
    "status": "valid",
    "type": "module",
    "version": "0.3.7"
  },
  "presentation": {
    "coverUrl": "https://opengraph.githubassets.com/38bc09c5d4dcc8686a3d9872e2bbd3803c4e05f822612c37d421e81887a19d13/PGZXB/dsh-feishu",
    "description": "The Feishu UI for DeepSeek Harness — a panel-driven control console: every slash command a button on the ⚙️ control-panel card, in-card approvals & questions, live streaming cards, one-QR setup. | DeepSeek Harness 的飞书 UI：面板驱动控制台——每个命令都是卡片按钮，卡内审批与提问，流式卡片，扫码一键配置。"
  },
  "readme": {
    "available": true,
    "excerpt": "The Feishu UI for DeepSeek Harness (dsh) — a dsh-native plugin with a panel-driven control console: every slash command is a button on the ⚙️ control-panel card, approvals and questions resolve inside the chat, and one QR scan sets the whole app up."
  },
  "schemaVersion": 1,
  "scripts": {
    "install": false,
    "postinstall": false,
    "preinstall": false,
    "prepare": false
  }
}
