{
  "bundle": {
    "detected": true,
    "patch": "./cordis.patch.yml",
    "patchExists": true
  },
  "crawl": {
    "enrichedAt": "2026-10-12T11:27:38.805Z",
    "enrichmentStatus": "ok",
    "headSha": "529e686890500092666f6a578ab6d898123d5c02"
  },
  "github": {
    "archived": false,
    "createdAt": "2026-08-28T11:23:12Z",
    "databaseId": 1349527724,
    "defaultBranch": "master",
    "description": "高精度文字识别。输入包含文本的图像，自动检测并识别内容。适用于各类文档、广告牌、屏幕截图等场景。",
    "fork": false,
    "forks": 0,
    "headSha": "529e686890500092666f6a578ab6d898123d5c02",
    "homepageUrl": null,
    "language": "TypeScript",
    "license": {
      "name": "MIT License",
      "spdxId": "MIT"
    },
    "nodeId": "R_kgDOUHAorA",
    "openGraphImageUrl": "https://opengraph.githubassets.com/329e9e8b8417422c228aa0ca17178a2596808933eb14284b7296c00ee545a2c4/xby-skill/xby-ocr-pro",
    "owner": {
      "avatarUrl": "https://avatars.githubusercontent.com/u/294784514?v=4",
      "login": "xby-skill"
    },
    "pushedAt": "2026-08-28T11:23:19Z",
    "slug": "xby-skill/xby-ocr-pro",
    "stars": 0,
    "topics": [
      "dsh-plugin"
    ],
    "updatedAt": "2026-09-02T04:45:00Z",
    "url": "https://github.com/xby-skill/xby-ocr-pro"
  },
  "id": "gh:1349527724",
  "install": {
    "available": true,
    "packageName": "xby-ocr-pro",
    "preferred": "github",
    "reason": null,
    "requiresBuildApproval": false,
    "spec": "github:xby-skill/xby-ocr-pro#529e686890500092666f6a578ab6d898123d5c02",
    "version": "1.0.0"
  },
  "npm": {
    "latestVersion": null,
    "published": false,
    "repositoryMatches": null
  },
  "package": {
    "main": "./dist/index.js",
    "name": "xby-ocr-pro",
    "status": "valid",
    "type": "module",
    "version": "1.0.0"
  },
  "presentation": {
    "coverUrl": "https://opengraph.githubassets.com/329e9e8b8417422c228aa0ca17178a2596808933eb14284b7296c00ee545a2c4/xby-skill/xby-ocr-pro",
    "description": "高精度文字识别。输入包含文本的图像，自动检测并识别内容。适用于各类文档、广告牌、屏幕截图等场景。"
  },
  "readme": {
    "available": true,
    "excerpt": "DeepSeek Harness (DSH) 的插件：文本识别OCR(增强版)"
  },
  "schemaVersion": 1,
  "scripts": {
    "install": false,
    "postinstall": false,
    "preinstall": false,
    "prepare": false
  }
}
