{
  "bundle": {
    "detected": false,
    "patch": null,
    "patchExists": null
  },
  "crawl": {
    "enrichedAt": "2026-10-21T09:20:09.852Z",
    "enrichmentStatus": "ok",
    "headSha": "550b7b6920bdaedb82dac1199147055671b7078f"
  },
  "github": {
    "archived": false,
    "createdAt": "2026-08-15T05:34:07Z",
    "databaseId": 1334820003,
    "defaultBranch": "main",
    "description": null,
    "fork": false,
    "forks": 0,
    "headSha": "550b7b6920bdaedb82dac1199147055671b7078f",
    "homepageUrl": null,
    "language": "JavaScript",
    "license": {
      "name": "MIT License",
      "spdxId": "MIT"
    },
    "nodeId": "R_kgDOT4-8ow",
    "openGraphImageUrl": "https://opengraph.githubassets.com/cd0ed46b4a3e7c8fab648d2444b55d91c18c464ad13088ce5f12a560f30e151f/FUSU123fusu/dsh-profile-port",
    "owner": {
      "avatarUrl": "https://avatars.githubusercontent.com/u/88240205?u=96e7e43e35caaa3c79d4613ce42494d12591a15c&v=4",
      "login": "FUSU123fusu"
    },
    "pushedAt": "2026-08-16T11:58:10Z",
    "slug": "FUSU123fusu/dsh-profile-port",
    "stars": 0,
    "topics": [
      "deepseek-harness",
      "dsh-plugin"
    ],
    "updatedAt": "2026-08-16T11:58:14Z",
    "url": "https://github.com/FUSU123fusu/dsh-profile-port"
  },
  "id": "gh:1334820003",
  "install": {
    "available": false,
    "packageName": null,
    "preferred": null,
    "reason": "Repository does not expose an installable DSH bundle.",
    "requiresBuildApproval": false,
    "spec": null,
    "version": null
  },
  "npm": {
    "latestVersion": null,
    "published": false,
    "repositoryMatches": null
  },
  "package": {
    "main": null,
    "name": "dsh-profile-port",
    "status": "valid",
    "type": "module",
    "version": "0.1.0"
  },
  "presentation": {
    "coverUrl": "https://opengraph.githubassets.com/cd0ed46b4a3e7c8fab648d2444b55d91c18c464ad13088ce5f12a560f30e151f/FUSU123fusu/dsh-profile-port",
    "description": "DeepSeek Harness（dsh）profile 的导出/导入工具：把一个 profile 打包成自包含目录，在另一台机器（或另一个 DSHHOME）一条命令复刻。"
  },
  "readme": {
    "available": true,
    "excerpt": "DeepSeek Harness（dsh）profile 的导出/导入工具：把一个 profile 打包成自包含目录，在另一台机器（或另一个 DSHHOME）一条命令复刻。"
  },
  "schemaVersion": 1,
  "scripts": {
    "install": false,
    "postinstall": false,
    "preinstall": false,
    "prepare": false
  }
}
