{
  "bundle": {
    "detected": true,
    "patch": "./cordis.patch.yml",
    "patchExists": true
  },
  "crawl": {
    "enrichedAt": "2026-10-16T08:53:30.528Z",
    "enrichmentStatus": "ok",
    "headSha": "8ce816ce01ab6682e397742bfe36aa4fdb0aaf4d"
  },
  "github": {
    "archived": false,
    "createdAt": "2026-10-11T07:41:35Z",
    "databaseId": 1414077184,
    "defaultBranch": "main",
    "description": "Stop & delete DeepSeek Harness sessions from the sidebar menu — cancels the running turn, subagents, background jobs and reminders, then removes the log, projection cache and workspace record. 「停止」与「删除」会话：先停工作，再删日志、缓存与工作区记录，并在有新版本时提示。",
    "fork": false,
    "forks": 0,
    "headSha": "8ce816ce01ab6682e397742bfe36aa4fdb0aaf4d",
    "homepageUrl": "https://www.npmjs.com/package/dsh-session-remove",
    "language": "JavaScript",
    "license": {
      "name": "MIT License",
      "spdxId": "MIT"
    },
    "nodeId": "R_kgDOVEkbAA",
    "openGraphImageUrl": "https://opengraph.githubassets.com/e139c70cdf1ef590dcd9aaaf769ff0614144c2735d6ae0781c87a54b807e4777/BG0EXM/dsh-session-remove",
    "owner": {
      "avatarUrl": "https://avatars.githubusercontent.com/u/232817976?v=4",
      "login": "BG0EXM"
    },
    "pushedAt": "2026-10-11T09:06:28Z",
    "slug": "BG0EXM/dsh-session-remove",
    "stars": 1,
    "topics": [
      "cordis",
      "deepseek-harness",
      "dsh",
      "dsh-plugin",
      "session-management"
    ],
    "updatedAt": "2026-10-12T15:06:18Z",
    "url": "https://github.com/BG0EXM/dsh-session-remove"
  },
  "id": "gh:1414077184",
  "install": {
    "available": true,
    "packageName": "dsh-session-remove",
    "preferred": "npm",
    "reason": null,
    "requiresBuildApproval": false,
    "spec": "dsh-session-remove@1.0.4",
    "version": "1.0.4"
  },
  "npm": {
    "latestVersion": "1.0.4",
    "published": true,
    "repositoryMatches": true
  },
  "package": {
    "exports": {
      ".": "./index.js",
      "./client": "./client.js",
      "./locale/*.json": "./locale/*.json",
      "./package.json": "./package.json"
    },
    "main": null,
    "name": "dsh-session-remove",
    "status": "valid",
    "type": "module",
    "version": "1.0.4"
  },
  "presentation": {
    "coverUrl": "https://opengraph.githubassets.com/e139c70cdf1ef590dcd9aaaf769ff0614144c2735d6ae0781c87a54b807e4777/BG0EXM/dsh-session-remove",
    "description": "Stop & delete DeepSeek Harness sessions from the sidebar menu — cancels the running turn, subagents, background jobs and reminders, then removes the log, projection cache and workspace record. 「停止」与「删除」会话：先停工作，再删日志、缓存与工作区记录，并在有新版本时提示。"
  },
  "readme": {
    "available": true,
    "excerpt": "Stop and permanently delete sessions from the DeepSeek Harness sidebar — plus a notice when a new release is out. 给 DeepSeek Harness 侧栏的会话菜单补上「停止」与「删除」，并在有新版本时提示更新。"
  },
  "schemaVersion": 1,
  "scripts": {
    "install": false,
    "postinstall": false,
    "preinstall": false,
    "prepare": false
  }
}
