{
  "bundle": {
    "detected": true,
    "patch": "./cordis.patch.yml",
    "patchExists": true
  },
  "crawl": {
    "enrichedAt": "2026-10-19T09:37:27.342Z",
    "enrichmentStatus": "ok",
    "headSha": "584df140d5ffa60bdf7d2fd3c22e2bc401704480"
  },
  "github": {
    "archived": false,
    "createdAt": "2026-08-16T03:48:52Z",
    "databaseId": 1335601307,
    "defaultBranch": "main",
    "description": "Open the current project directory in a native editor from the DeepSeek Harness web GUI: the session header's editor picker, and the host half that finds the installed editors and launches one",
    "fork": false,
    "forks": 0,
    "headSha": "584df140d5ffa60bdf7d2fd3c22e2bc401704480",
    "homepageUrl": null,
    "language": "TypeScript",
    "license": {
      "name": "MIT License",
      "spdxId": "MIT"
    },
    "nodeId": "R_kgDOT5uomw",
    "openGraphImageUrl": "https://opengraph.githubassets.com/0c985747c4a9af9ae84058872dc5383908a89fcb1481603c33980a841cc29811/omdsh-plugins/omdsh-editor",
    "owner": {
      "avatarUrl": "https://avatars.githubusercontent.com/u/317373669?v=4",
      "login": "omdsh-plugins"
    },
    "pushedAt": "2026-09-03T16:45:57Z",
    "slug": "omdsh-plugins/omdsh-editor",
    "stars": 0,
    "topics": [
      "dsh",
      "dsh-plugin"
    ],
    "updatedAt": "2026-09-03T16:50:37Z",
    "url": "https://github.com/omdsh-plugins/omdsh-editor"
  },
  "id": "gh:1335601307",
  "install": {
    "available": true,
    "packageName": "@omdsh-plugins/omdsh-editor",
    "preferred": "github",
    "reason": null,
    "requiresBuildApproval": true,
    "spec": "github:omdsh-plugins/omdsh-editor#584df140d5ffa60bdf7d2fd3c22e2bc401704480",
    "version": "0.2.4"
  },
  "npm": {
    "latestVersion": null,
    "published": false,
    "repositoryMatches": null
  },
  "package": {
    "exports": {
      ".": {
        "default": "./lib/index.js",
        "types": "./lib/types/index.d.ts"
      },
      "./client": {
        "default": "./lib/client.js",
        "types": "./lib/types/client/index.d.ts"
      },
      "./invariant": {
        "default": "./lib/invariant.js",
        "types": "./lib/types/invariant.d.ts"
      },
      "./package.json": "./package.json",
      "./src/*": "./src/*"
    },
    "main": "lib/index.js",
    "name": "@omdsh-plugins/omdsh-editor",
    "status": "valid",
    "type": "module",
    "version": "0.2.4"
  },
  "presentation": {
    "coverUrl": "https://opengraph.githubassets.com/0c985747c4a9af9ae84058872dc5383908a89fcb1481603c33980a841cc29811/omdsh-plugins/omdsh-editor",
    "description": "Open the current project directory in a native editor from the DeepSeek Harness web GUI: the session header's editor picker, and the host half that finds the installed editors and launches one"
  },
  "readme": {
    "available": true,
    "excerpt": "Open the project you are working in with the editor you actually use. A split control in the DeepSeek Harness web GUI's session header: press the left half and the conversation's directory opens in the editor you chose last time, press the chevron and pick a different one."
  },
  "schemaVersion": 1,
  "scripts": {
    "install": false,
    "postinstall": false,
    "preinstall": false,
    "prepare": true
  }
}
