{
  "bundle": {
    "detected": false,
    "patch": null,
    "patchExists": null
  },
  "crawl": {
    "enrichedAt": "2026-08-24T02:17:52.033Z",
    "enrichmentStatus": "ok",
    "headSha": "fe51d1ffc9fe8728ac36d2bb4a34042040bc3291"
  },
  "github": {
    "archived": false,
    "createdAt": "2026-08-03T11:14:49Z",
    "databaseId": 1321669897,
    "defaultBranch": "main",
    "description": "Enterprise L7 AI Governance, Ex-Ante PII Redaction (<1.16ms RAM), and Cryptographic Forensic Evidence Vault for LLM Ecosystems & DeepSeek Harness (ISO 42001 / DORA / EU AI Act).",
    "fork": false,
    "forks": 0,
    "headSha": "fe51d1ffc9fe8728ac36d2bb4a34042040bc3291",
    "homepageUrl": "https://www.saare.es/",
    "language": "JavaScript",
    "license": null,
    "nodeId": "R_kgDOTscVCQ",
    "openGraphImageUrl": "https://opengraph.githubassets.com/d53bb76d5714f3e64aee51554a477fa0da6db9b9e8440e811e71da813e69024c/alfonsoferrertorres-cyber/saare-suite",
    "owner": {
      "avatarUrl": "https://avatars.githubusercontent.com/u/288150953?v=4",
      "login": "alfonsoferrertorres-cyber"
    },
    "pushedAt": "2026-08-24T01:52:57Z",
    "slug": "alfonsoferrertorres-cyber/saare-suite",
    "stars": 0,
    "topics": [
      "ai-governance",
      "deepseek-harness",
      "dsh",
      "dsh-plugin",
      "iso42001"
    ],
    "updatedAt": "2026-08-24T01:53:16Z",
    "url": "https://github.com/alfonsoferrertorres-cyber/saare-suite"
  },
  "id": "gh:1321669897",
  "install": {
    "available": false,
    "packageName": null,
    "preferred": null,
    "reason": "Repository does not expose an installable DSH bundle.",
    "requiresBuildApproval": false,
    "spec": null,
    "version": null
  },
  "npm": {
    "latestVersion": null,
    "published": false,
    "repositoryMatches": null
  },
  "package": {
    "main": null,
    "name": "saare-ecosystem",
    "status": "valid",
    "type": null,
    "version": "2.5.0"
  },
  "presentation": {
    "coverUrl": "https://opengraph.githubassets.com/d53bb76d5714f3e64aee51554a477fa0da6db9b9e8440e811e71da813e69024c/alfonsoferrertorres-cyber/saare-suite",
    "description": "Enterprise L7 AI Governance, Ex-Ante PII Redaction (<1.16ms RAM), and Cryptographic Forensic Evidence Vault for LLM Ecosystems & DeepSeek Harness (ISO 42001 / DORA / EU AI Act)."
  },
  "readme": {
    "available": true,
    "excerpt": "---"
  },
  "schemaVersion": 1,
  "scripts": {
    "install": false,
    "postinstall": false,
    "preinstall": false,
    "prepare": false
  }
}
