{
  "bundle": {
    "detected": true,
    "patch": "./cordis.patch.yml",
    "patchExists": true
  },
  "crawl": {
    "enrichedAt": "2026-10-25T09:04:43.832Z",
    "enrichmentStatus": "ok",
    "headSha": "7aadebd56c41995ca828e0ec19262608ca9d1e53"
  },
  "github": {
    "archived": false,
    "createdAt": "2026-08-14T03:00:38Z",
    "databaseId": 1333733989,
    "defaultBranch": "main",
    "description": null,
    "fork": false,
    "forks": 0,
    "headSha": "7aadebd56c41995ca828e0ec19262608ca9d1e53",
    "homepageUrl": null,
    "language": "JavaScript",
    "license": {
      "name": "GNU General Public License v3.0",
      "spdxId": "GPL-3.0"
    },
    "nodeId": "R_kgDOT38qZQ",
    "openGraphImageUrl": "https://opengraph.githubassets.com/fc51a1528c0f43a14c2000a1305d88c3245dd111d8e12f84128cbac8f432bbc6/LingyeSoul/dsh-rider",
    "owner": {
      "avatarUrl": "https://avatars.githubusercontent.com/u/57278745?u=53c2d936ad8cd493487a6593a94c87bb31d4a4e5&v=4",
      "login": "LingyeSoul"
    },
    "pushedAt": "2026-09-29T15:45:04Z",
    "slug": "LingyeSoul/dsh-rider",
    "stars": 1,
    "topics": [
      "dsh-plugin"
    ],
    "updatedAt": "2026-10-16T10:53:10Z",
    "url": "https://github.com/LingyeSoul/dsh-rider"
  },
  "id": "gh:1333733989",
  "install": {
    "available": true,
    "packageName": "dsh-rider",
    "preferred": "github",
    "reason": null,
    "requiresBuildApproval": false,
    "spec": "github:LingyeSoul/dsh-rider#7aadebd56c41995ca828e0ec19262608ca9d1e53",
    "version": "0.6.0"
  },
  "npm": {
    "latestVersion": null,
    "published": false,
    "repositoryMatches": null
  },
  "package": {
    "exports": {
      ".": "./index.mjs",
      "./client": "./client/index.js",
      "./icon.svg": "./icon.svg",
      "./locale/*.json": "./locale/*.json",
      "./package.json": "./package.json"
    },
    "main": "./index.mjs",
    "name": "dsh-rider",
    "status": "valid",
    "type": "module",
    "version": "0.6.0"
  },
  "presentation": {
    "coverUrl": "https://opengraph.githubassets.com/fc51a1528c0f43a14c2000a1305d88c3245dd111d8e12f84128cbac8f432bbc6/LingyeSoul/dsh-rider",
    "description": "DSH 官方 bundle 插件：免费网络搜索工具 duckduckgosearch（零 API key）"
  },
  "readme": {
    "available": true,
    "excerpt": "DSH 官方 bundle 插件：免费网络搜索工具 duckduckgosearch（零 API key）"
  },
  "schemaVersion": 1,
  "scripts": {
    "install": false,
    "postinstall": false,
    "preinstall": false,
    "prepare": false
  }
}
